{
  "episode_id": "ForeignCarsTH_cadillac-cimarron",
  "status": "verified",
  "research_language": "auto",
  "working_language": "en",
  "quirk_lead": {
    "text": "Cadillac's infamous attempt to turn the GM J-car into a luxury compact",
    "note": "Research lead only -- not a verified fact. Evidence supports a narrower thesis (Cadillac made real, documented changes but joined the J-car program too late to differentiate enough) rather than the quirk's blunter 'infamous attempt' framing. 'Infamous' is a retrospective judgment (see l01/r02), not a contemporary fact."
  },
  "claims": [
    {
      "claim_id": "p01_cimarron_price",
      "normalized_claim": "The 1982 Cadillac Cimarron's launch base price was in the $12,131-$12,181 range.",
      "claim_type": "statistic",
      "time_context": "1982 model year",
      "sources": [
        {
          "url": "https://en.wikipedia.org/wiki/Cadillac_Cimarron",
          "title": "Cadillac Cimarron",
          "publisher": "Wikipedia",
          "source_language": "en",
          "source_classification": "reference_source",
          "access_status": "read_full",
          "evidence_note": "Gives the 1982 list price as $12,181.",
          "evidence_location": "Article body, first-generation / pricing discussion"
        },
        {
          "url": "https://macsmotorcitygarage.com/cadillacs-small-mistake-the-1982-1988-cimarron/",
          "title": "Cadillac's Small Mistake: The 1982-1988 Cimarron",
          "publisher": "Mac's Motor City Garage",
          "source_language": "en",
          "source_classification": "reputable_secondary",
          "access_status": "read_full",
          "evidence_note": "Gives base price $12,131 at introduction, dated to May 21, 1981.",
          "evidence_location": "Article body, introduction/pricing paragraph"
        }
      ],
      "perspective": "timeless_or_historical_fact",
      "confidence": "high",
      "allowed_in_narration": true,
      "safe_wording": "The 1982 Cimarron launched at roughly $12,100-12,200.",
      "forbidden_or_unsupported_inference": [
        "Presenting one exact figure as the single undisputed price without acknowledging the range"
      ],
      "conflicting_evidence": [
        "Wikipedia gives $12,181; Mac's Motor City Garage gives $12,131. A $50 gap, likely a rounding or mid-year adjustment difference. Both retained rather than silently resolved."
      ],
      "notes": "Price is a category the audit flags as needing stronger corroboration; two independent sources converging within $50 on a claim this central to the episode is proportional support. Derived comparisons below deliberately use the LOWER figure ($12,131) so the computed premium is the conservative one."
    },
    {
      "claim_id": "p02_cavalier_cl_sedan_price",
      "normalized_claim": "The 1982 Chevrolet Cavalier CL 4-door sedan -- the top Cavalier sedan trim -- had an original MSRP of $8,499.",
      "claim_type": "statistic",
      "time_context": "1982 model year",
      "sources": [
        {
          "url": "https://www.cargurus.com/Cars/1982-Chevrolet-Cavalier-Trims-c4297",
          "title": "1982 Chevrolet Cavalier Trim and Specs",
          "publisher": "CarGurus",
          "source_language": "en",
          "source_classification": "reference_source",
          "access_status": "read_full",
          "evidence_note": "Full 1982 Cavalier trim table explicitly labeled 'Original MSRP'; CL Sedan FWD listed at $8,499.",
          "evidence_location": "Trims table, CL Sedan FWD row"
        }
      ],
      "perspective": "timeless_or_historical_fact",
      "confidence": "medium",
      "allowed_in_narration": true,
      "safe_wording": "A top-trim Cavalier CL sedan listed at $8,499 that year.",
      "forbidden_or_unsupported_inference": [
        "Treating this base CL price as a 'comparably equipped to a Cimarron' price -- it is the CL's own base MSRP, with no Cimarron-matching options added (see u01)"
      ],
      "conflicting_evidence": [
        "A prior research pass attributed $8,137 as the Cavalier CL starting price to Curbside Classic via a search snippet. That figure is contradicted by this readable Original-MSRP table and is not used."
      ],
      "notes": "Price is a category needing stronger corroboration; this rests on a single reference-grade aggregator table, so confidence stays medium rather than high even though the table is internally consistent and was read in full. Proportional treatment: not blocked (nothing disputes it, it's not surprising), but not treated as fully settled either."
    },
    {
      "claim_id": "p03_cavalier_cadet_coupe_price",
      "normalized_claim": "The cheapest 1982 Chevrolet Cavalier, the Cadet 2-door coupe, had an original MSRP of $6,648.",
      "claim_type": "statistic",
      "time_context": "1982 model year",
      "sources": [
        {
          "url": "https://www.cargurus.com/Cars/1982-Chevrolet-Cavalier-Trims-c4297",
          "title": "1982 Chevrolet Cavalier Trim and Specs",
          "publisher": "CarGurus",
          "source_language": "en",
          "source_classification": "reference_source",
          "access_status": "read_full",
          "evidence_note": "Cadet Coupe FWD listed at $6,648 as the lowest of eleven 1982 Cavalier trims.",
          "evidence_location": "Trims table, Cadet Coupe FWD row"
        }
      ],
      "perspective": "timeless_or_historical_fact",
      "confidence": "medium",
      "allowed_in_narration": true,
      "safe_wording": "The cheapest Cavalier, the stripped Cadet coupe, started at $6,648.",
      "forbidden_or_unsupported_inference": [
        "Using this stripped-coupe price as the general 'a Cavalier cost X' comparator without naming the trim"
      ],
      "conflicting_evidence": [],
      "notes": "Same sourcing caveat as p02."
    },
    {
      "claim_id": "d01_premium_vs_cl_sedan",
      "normalized_claim": "The Cimarron's base price was about 43% above the top-trim Cavalier CL sedan's base price.",
      "claim_type": "derived_comparison",
      "time_context": "1982 model year",
      "sources": [],
      "source_claim_ids": ["p01_cimarron_price", "p02_cavalier_cl_sedan_price"],
      "calculation": "(12131 - 8499) / 8499 * 100",
      "result": "42.7% premium (a $3,632 gap) using the lower Cimarron figure; 43.3% ($3,682) using the higher one. Both trims at their own base MSRP, no options on either side.",
      "perspective": "timeless_or_historical_fact",
      "confidence": "medium",
      "allowed_in_narration": true,
      "safe_wording": "Against the most expensive Cavalier sedan you could buy, the Cimarron cost roughly 43% more -- about $3,600.",
      "forbidden_or_unsupported_inference": [
        "Describing this as 'nearly double' -- it is not; that framing belongs only to d02's stripped-coupe comparison, and even there with its comparator named",
        "Describing this as an equipment-matched comparison -- neither car is optioned here, and the Cimarron included as standard a number of things the CL did not (see e01-e04)"
      ],
      "conflicting_evidence": [],
      "notes": "This is the fairest verified like-for-like comparison currently available: both figures are base MSRPs of named trims from one readable table plus a documented Cimarron price. It replaces the earlier unresolved 'comparably equipped' calculation (u01/u02), which the episode no longer depends on."
    },
    {
      "claim_id": "d02_premium_vs_cadet_coupe",
      "normalized_claim": "The Cimarron's base price was about 83% above the cheapest Cavalier's base price.",
      "claim_type": "derived_comparison",
      "time_context": "1982 model year",
      "sources": [],
      "source_claim_ids": ["p01_cimarron_price", "p03_cavalier_cadet_coupe_price"],
      "calculation": "(12131 - 6648) / 6648 * 100",
      "result": "82.5% premium (a $5,483 gap) using the lower Cimarron figure; 83.2% ($5,533) using the higher one -- close to double, but only against the cheapest, most stripped-out Cavalier body style.",
      "perspective": "timeless_or_historical_fact",
      "confidence": "medium",
      "allowed_in_narration": true,
      "safe_wording": "Set against the cheapest Cavalier on the lot -- the stripped Cadet coupe -- the Cimarron cost about 83% more, close to double.",
      "forbidden_or_unsupported_inference": [
        "Quoting the 'close to double' framing without naming that the comparator is the cheapest stripped Cadet coupe",
        "Presenting this as THE Cimarron-vs-Cavalier premium; d01 is the like-for-like trim comparison and is roughly half this size"
      ],
      "conflicting_evidence": [
        "d01, computed against the top Cavalier sedan trim, gives ~43% -- roughly half of this figure. Both are correct for their stated comparators; the gap between them is the whole reason the comparator must always be named."
      ],
      "notes": "Retained because the 'nearly double' framing is widespread in retrospectives; keeping it with its comparator explicit lets the script address that framing honestly instead of repeating or ignoring it."
    },
    {
      "claim_id": "u01_cavalier_cl_equipped_price",
      "normalized_claim": "A 1982 Cavalier CL optioned up to Cimarron-equivalent specification cost approximately $9,712.",
      "claim_type": "statistic",
      "time_context": "1982 model year",
      "sources": [
        {
          "url": "https://www.curbsideclassic.com/vintage-reviews/vintage-reviews-cadillac-cimarron/",
          "title": "Vintage Reviews: Cadillac Cimarron 1982-1985 - Clippings From The Mediocrity Files",
          "publisher": "Curbside Classic",
          "source_language": "en",
          "source_classification": "reputable_secondary",
          "access_status": "search_snippet_only",